{
  "schema_version": 1,
  "id": "bluestacks-no-bootstrap",
  "description": "Synthetic BlueStacks Tier B case where ADB exists but no in-guest bootstrap or lifecycle evidence is available.",
  "input": {
    "bootstrap": {"root_available": false},
    "layout": {"system_fs_type": "ext4", "system_source": "/dev/block/dm-0", "system_writable_view": true, "system_writable_backing": true, "overlayfs": false, "dynamic_partitions": true, "dm_verity": false, "avb_state": "unlocked", "ext4_features": [], "ext4_features_probe": "observed", "shared_blocks": false, "device_mapper": {"probe": "observed", "layers": [{"source": "/dev/block/dm-0", "resolved_source": "/dev/block/dm-0", "name": "system", "uuid": null, "slaves": ["sda"], "target_probe": "observed", "target_types": ["linear"]}]}},
    "init": {"import_proof": "unproven"},
    "selinux": {"enabled": true, "state": "enforcing", "strategy": "split"},
    "staging": {"required_bytes": 33554432, "sufficient": true},
    "recovery": {"verified": false},
    "persistence": {"proven": false},
    "existing_install": {"system_mode": false, "manifest_present": false}
  },
  "expected": {
    "verdict": "blocked",
    "primary_reason": "NO_BOOTSTRAP_ROOT",
    "reason_codes": ["NO_BOOTSTRAP_ROOT", "INIT_IMPORT_UNPROVEN", "NO_RECOVERY_PATH", "PERSISTENT_WRITABILITY_UNPROVEN"]
  }
}
